{
  "schemaVersion": 1,
  "browser": "chromium",
  "userAgent": "Mozilla/5.0 (X11; Linux x86_64) AppleWebKit/537.36 (KHTML, like Gecko) HeadlessChrome/151.0.7922.34 Safari/537.36",
  "cases": [
    {
      "id": "grammar.four-side.one",
      "accepted": true,
      "items": [
        "padding-top",
        "padding-right",
        "padding-bottom",
        "padding-left"
      ],
      "longhands": [
        {
          "name": "padding-top",
          "value": "1px",
          "priority": ""
        },
        {
          "name": "padding-right",
          "value": "1px",
          "priority": ""
        },
        {
          "name": "padding-bottom",
          "value": "1px",
          "priority": ""
        },
        {
          "name": "padding-left",
          "value": "1px",
          "priority": ""
        }
      ],
      "shorthandValue": "1px",
      "priority": "",
      "cssText": "padding: 1px;"
    },
    {
      "id": "grammar.four-side.two",
      "accepted": true,
      "items": [
        "padding-top",
        "padding-right",
        "padding-bottom",
        "padding-left"
      ],
      "longhands": [
        {
          "name": "padding-top",
          "value": "1px",
          "priority": ""
        },
        {
          "name": "padding-right",
          "value": "2px",
          "priority": ""
        },
        {
          "name": "padding-bottom",
          "value": "1px",
          "priority": ""
        },
        {
          "name": "padding-left",
          "value": "2px",
          "priority": ""
        }
      ],
      "shorthandValue": "1px 2px",
      "priority": "",
      "cssText": "padding: 1px 2px;"
    },
    {
      "id": "grammar.four-side.four",
      "accepted": true,
      "items": [
        "padding-top",
        "padding-right",
        "padding-bottom",
        "padding-left"
      ],
      "longhands": [
        {
          "name": "padding-top",
          "value": "1px",
          "priority": ""
        },
        {
          "name": "padding-right",
          "value": "2px",
          "priority": ""
        },
        {
          "name": "padding-bottom",
          "value": "3px",
          "priority": ""
        },
        {
          "name": "padding-left",
          "value": "4px",
          "priority": ""
        }
      ],
      "shorthandValue": "1px 2px 3px 4px",
      "priority": "",
      "cssText": "padding: 1px 2px 3px 4px;"
    },
    {
      "id": "grammar.four-side.five-invalid",
      "accepted": false,
      "items": [],
      "longhands": [],
      "shorthandValue": "",
      "priority": "",
      "cssText": ""
    },
    {
      "id": "grammar.two-value.one",
      "accepted": true,
      "items": [
        "row-gap",
        "column-gap"
      ],
      "longhands": [
        {
          "name": "row-gap",
          "value": "1px",
          "priority": ""
        },
        {
          "name": "column-gap",
          "value": "1px",
          "priority": ""
        }
      ],
      "shorthandValue": "1px",
      "priority": "",
      "cssText": "gap: 1px;"
    },
    {
      "id": "grammar.two-value.two",
      "accepted": true,
      "items": [
        "row-gap",
        "column-gap"
      ],
      "longhands": [
        {
          "name": "row-gap",
          "value": "1px",
          "priority": ""
        },
        {
          "name": "column-gap",
          "value": "2px",
          "priority": ""
        }
      ],
      "shorthandValue": "1px 2px",
      "priority": "",
      "cssText": "gap: 1px 2px;"
    },
    {
      "id": "grammar.two-value.keyword-pair",
      "accepted": true,
      "items": [
        "overscroll-behavior-x",
        "overscroll-behavior-y"
      ],
      "longhands": [
        {
          "name": "overscroll-behavior-x",
          "value": "contain",
          "priority": ""
        },
        {
          "name": "overscroll-behavior-y",
          "value": "none",
          "priority": ""
        }
      ],
      "shorthandValue": "contain none",
      "priority": "",
      "cssText": "overscroll-behavior: contain none;"
    },
    {
      "id": "grammar.two-value.overscroll-chain",
      "accepted": true,
      "items": [
        "overscroll-behavior-x",
        "overscroll-behavior-y"
      ],
      "longhands": [
        {
          "name": "overscroll-behavior-x",
          "value": "chain",
          "priority": ""
        },
        {
          "name": "overscroll-behavior-y",
          "value": "contain",
          "priority": ""
        }
      ],
      "shorthandValue": "chain contain",
      "priority": "",
      "cssText": "overscroll-behavior: chain contain;"
    },
    {
      "id": "grammar.two-value.three-invalid",
      "accepted": false,
      "items": [],
      "longhands": [],
      "shorthandValue": "",
      "priority": "",
      "cssText": ""
    },
    {
      "id": "grammar.slash-pair.one",
      "accepted": true,
      "items": [
        "grid-column-start",
        "grid-column-end"
      ],
      "longhands": [
        {
          "name": "grid-column-start",
          "value": "1",
          "priority": ""
        },
        {
          "name": "grid-column-end",
          "value": "auto",
          "priority": ""
        }
      ],
      "shorthandValue": "1",
      "priority": "",
      "cssText": "grid-column: 1;"
    },
    {
      "id": "grammar.slash-pair.two",
      "accepted": true,
      "items": [
        "grid-column-start",
        "grid-column-end"
      ],
      "longhands": [
        {
          "name": "grid-column-start",
          "value": "1",
          "priority": ""
        },
        {
          "name": "grid-column-end",
          "value": "3",
          "priority": ""
        }
      ],
      "shorthandValue": "1 / 3",
      "priority": "",
      "cssText": "grid-column: 1 / 3;"
    },
    {
      "id": "grammar.slash-pair.named",
      "accepted": true,
      "items": [
        "grid-row-start",
        "grid-row-end"
      ],
      "longhands": [
        {
          "name": "grid-row-start",
          "value": "header",
          "priority": ""
        },
        {
          "name": "grid-row-end",
          "value": "footer",
          "priority": ""
        }
      ],
      "shorthandValue": "header / footer",
      "priority": "",
      "cssText": "grid-row: header / footer;"
    },
    {
      "id": "grammar.slash-pair.three-invalid",
      "accepted": false,
      "items": [],
      "longhands": [],
      "shorthandValue": "",
      "priority": "",
      "cssText": ""
    },
    {
      "id": "grammar.animation.single",
      "accepted": true,
      "items": [
        "animation-duration",
        "animation-timing-function",
        "animation-delay",
        "animation-iteration-count",
        "animation-direction",
        "animation-fill-mode",
        "animation-play-state",
        "animation-name",
        "animation-timeline",
        "animation-range-start",
        "animation-range-end"
      ],
      "longhands": [
        {
          "name": "animation-duration",
          "value": "1s",
          "priority": ""
        },
        {
          "name": "animation-timing-function",
          "value": "ease",
          "priority": ""
        },
        {
          "name": "animation-delay",
          "value": "0s",
          "priority": ""
        },
        {
          "name": "animation-iteration-count",
          "value": "1",
          "priority": ""
        },
        {
          "name": "animation-direction",
          "value": "normal",
          "priority": ""
        },
        {
          "name": "animation-fill-mode",
          "value": "none",
          "priority": ""
        },
        {
          "name": "animation-play-state",
          "value": "running",
          "priority": ""
        },
        {
          "name": "animation-name",
          "value": "foo",
          "priority": ""
        },
        {
          "name": "animation-timeline",
          "value": "auto",
          "priority": ""
        },
        {
          "name": "animation-range-start",
          "value": "normal",
          "priority": ""
        },
        {
          "name": "animation-range-end",
          "value": "normal",
          "priority": ""
        }
      ],
      "shorthandValue": "1s ease 0s 1 normal none running foo",
      "priority": "",
      "cssText": "animation: 1s ease 0s 1 normal none running foo;"
    },
    {
      "id": "grammar.animation.multiple",
      "accepted": true,
      "items": [
        "animation-duration",
        "animation-timing-function",
        "animation-delay",
        "animation-iteration-count",
        "animation-direction",
        "animation-fill-mode",
        "animation-play-state",
        "animation-name",
        "animation-timeline",
        "animation-range-start",
        "animation-range-end"
      ],
      "longhands": [
        {
          "name": "animation-duration",
          "value": "1s, 2s",
          "priority": ""
        },
        {
          "name": "animation-timing-function",
          "value": "ease, linear",
          "priority": ""
        },
        {
          "name": "animation-delay",
          "value": "0s, 0s",
          "priority": ""
        },
        {
          "name": "animation-iteration-count",
          "value": "1, 1",
          "priority": ""
        },
        {
          "name": "animation-direction",
          "value": "normal, normal",
          "priority": ""
        },
        {
          "name": "animation-fill-mode",
          "value": "none, none",
          "priority": ""
        },
        {
          "name": "animation-play-state",
          "value": "running, running",
          "priority": ""
        },
        {
          "name": "animation-name",
          "value": "foo, bar",
          "priority": ""
        },
        {
          "name": "animation-timeline",
          "value": "auto",
          "priority": ""
        },
        {